{
  "$schema": "https://json-schema.org/draft/2020-12/schema",
  "$id": "https://github.com/davicalvarenga/Sistema-MicServ-SD/docs/contratos/schemas/pedido_atualizado.schema.json",
  "title": "pedido_atualizado (o que o fornecimentos-service precisa receber)",
  "description": "Publicado pelo pedidos-service. O fornecimentos-service age só nos status de cancelamento e de venda concluída e ignora os demais.",
  "type": "object",
  "required": [
    "eventId",
    "eventType",
    "eventVersion",
    "timestamp",
    "source",
    "correlationId",
    "aggregateId",
    "payload"
  ],
  "additionalProperties": true,
  "properties": {
    "eventId": {
      "type": "string",
      "format": "uuid",
      "description": "Identificador único do evento. Usado na idempotência (processed_events)."
    },
    "eventType": {
      "const": "pedido_atualizado"
    },
    "eventVersion": {
      "const": "1.0"
    },
    "timestamp": {
      "type": "string",
      "format": "date-time",
      "description": "Momento da publicação, ISO-8601 em UTC."
    },
    "source": {
      "const": "pedidos-service"
    },
    "correlationId": {
      "type": "string",
      "minLength": 1,
      "description": "Vem do cabeçalho X-Correlation-Id da requisição ou do evento que originou este. Não é necessariamente UUID: o gateway do kit usa o $request_id do Nginx (32 caracteres hexadecimais) quando o cliente não envia o cabeçalho."
    },
    "aggregateId": {
      "type": "string",
      "minLength": 1,
      "description": "Chave da mensagem no Kafka: pedidoId."
    },
    "payload": {
      "type": "object",
      "required": [
        "pedidoId",
        "fornecimentoId",
        "status"
      ],
      "properties": {
        "pedidoId": {
          "type": "string",
          "minLength": 1,
          "maxLength": 64
        },
        "fornecimentoId": {
          "type": "string",
          "minLength": 1,
          "maxLength": 64
        },
        "status": {
          "type": "string",
          "minLength": 1,
          "description": "Os valores que indicam cancelamento e venda concluída precisam ser informados pelo grupo de Pedidos (P-02)."
        }
      },
      "additionalProperties": true
    }
  }
}
